{
  "$schema": "https://json-schema.org/draft/2020-12/schema",
  "$id": "https://bluecontract.org/schemas/coordination/nested-agreement-flagship-trace.schema.json",
  "title": "Nested agreement structural and runtime evidence trace",
  "type": "object",
  "required": [
    "schema",
    "status",
    "run",
    "structuralEvidence",
    "runtimeLanes"
  ],
  "properties": {
    "schema": {
      "const": "blue-coordination/nested-agreement-flagship-trace/1.0"
    },
    "status": { "$ref": "#/$defs/evidenceStatus" },
    "run": {
      "type": "object",
      "required": ["id", "sourceTests"],
      "properties": {
        "id": { "type": "string", "minLength": 1 },
        "sourceTests": {
          "type": "array",
          "minItems": 1,
          "items": { "type": "string", "minLength": 1 }
        },
        "finishedAt": { "type": "string", "format": "date-time" }
      },
      "additionalProperties": false
    },
    "structuralEvidence": { "$ref": "#/$defs/structuralEvidence" },
    "runtimeLanes": {
      "type": "array",
      "minItems": 1,
      "items": { "$ref": "#/$defs/runtimeLane" }
    },
    "events": {
      "type": "array",
      "minItems": 1,
      "items": {
        "type": "object",
        "required": ["id", "target", "status"],
        "properties": {
          "id": { "type": "string", "minLength": 1 },
          "target": { "type": "string", "minLength": 1 },
          "status": { "const": "SUCCESS" },
          "resultingRootBlueId": { "type": ["string", "null"] },
          "publicEvents": { "type": "array" },
          "gas": { "type": "integer", "minimum": 0 }
        },
        "additionalProperties": true
      }
    },
    "matrixTotals": { "type": "object" },
    "subscriptionTransitions": { "type": ["object", "array"] },
    "maximumGasTrace": { "type": ["object", "array"] },
    "providerDemands": { "type": "object" },
    "causalTrace": { "type": ["object", "array"] }
  },
  "allOf": [
    {
      "if": {
        "properties": { "status": { "const": "passed" } },
        "required": ["status"]
      },
      "then": {
        "required": [
          "events",
          "matrixTotals",
          "subscriptionTransitions",
          "maximumGasTrace",
          "providerDemands"
        ]
      },
      "else": {
        "not": {
          "anyOf": [
            { "required": ["events"] },
            { "required": ["matrixTotals"] },
            { "required": ["subscriptionTransitions"] },
            { "required": ["maximumGasTrace"] },
            { "required": ["providerDemands"] },
            { "required": ["causalTrace"] }
          ]
        }
      }
    }
  ],
  "additionalProperties": false,
  "$defs": {
    "evidenceStatus": {
      "enum": ["passed", "failed", "notExecuted"]
    },
    "structuralEvidence": {
      "type": "object",
      "required": ["status", "sourceTests"],
      "properties": {
        "status": { "$ref": "#/$defs/evidenceStatus" },
        "sourceTests": {
          "type": "array",
          "minItems": 1,
          "items": { "type": "string", "minLength": 1 }
        },
        "scopePlan": { "type": ["object", "array"] },
        "fragmentInventory": { "type": ["object", "array"] },
        "reconstruction": { "type": "object" },
        "diagnostic": { "type": "string", "minLength": 1 }
      },
      "allOf": [
        {
          "if": {
            "properties": { "status": { "const": "passed" } },
            "required": ["status"]
          },
          "then": {
            "required": ["scopePlan", "fragmentInventory", "reconstruction"]
          },
          "else": { "required": ["diagnostic"] }
        }
      ],
      "additionalProperties": false
    },
    "runtimeLane": {
      "type": "object",
      "required": [
        "id",
        "status",
        "declaredScenarios",
        "attemptedScenarios",
        "completedScenarios"
      ],
      "properties": {
        "id": { "type": "string", "minLength": 1 },
        "status": { "$ref": "#/$defs/evidenceStatus" },
        "declaredScenarios": { "type": "integer", "minimum": 0 },
        "attemptedScenarios": { "type": "integer", "minimum": 0 },
        "completedScenarios": { "type": "integer", "minimum": 0 },
        "diagnostic": { "type": "string", "minLength": 1 }
      },
      "allOf": [
        {
          "if": {
            "properties": { "status": { "const": "failed" } },
            "required": ["status"]
          },
          "then": { "required": ["diagnostic"] }
        }
      ],
      "additionalProperties": false
    }
  }
}
